{
  "$schema": "../../../spec/docs/language.schema.json",
  "id": "typescript",
  "name": "TypeScript",
  "order": 10,
  "status": "preview",
  "codeFence": "ts",
  "regionComment": "//",
  "testedFences": ["ts", "typescript", "tsx", "mts", "cts", "js", "javascript", "jsx", "mjs", "cjs"],
  "snippetRoots": ["examples/src"],
  "packages": [
    {
      "name": "@instantrelay/server",
      "slug": "server",
      "layer": "server",
      "summary": "Server SDK for trusted Node.js runtimes: backend-key data-plane calls, management, webhook verification and push requests.",
      "runtime": "Node.js 22 or later",
      "source": "packages/server"
    },
    {
      "name": "@instantrelay/client",
      "slug": "client",
      "layer": "client",
      "summary": "Client SDK for apps on end-user devices: one signed-in user's conversations, realtime events and calls.",
      "runtime": "Current browsers. For React Native, see the React Native docs.",
      "source": "packages/client"
    },
    {
      "name": "@instantrelay/client/push",
      "slug": "client-push",
      "layer": "client",
      "summary": "Web Push for browsers and service workers: subscribe a browser, then show and open the notifications your backend sends. It ships with the client SDK.",
      "runtime": "Current browsers and their service workers. No dependencies.",
      "source": "packages/client"
    },
    {
      "name": "@instantrelay/react",
      "slug": "react",
      "layer": "client",
      "summary": "React hooks over the client SDK: conversations with offline-safe sends, typing, session renewal, calls and browser media.",
      "runtime": "React 18 or later in current browsers. For React Native, see the React Native docs.",
      "source": "packages/react"
    }
  ],
  "quickstarts": ["server", "client", "webhooks", "push", "calling"],
  "operations": "operations.json",
  "extract": {
    "command": ["node", "tools/docgen/extractors/typescript.mjs", "docs/languages/typescript/language.json"]
  },
  "test": {
    "install": ["npm", "ci", "--prefix", "docs/languages/typescript/examples", "--ignore-scripts", "--omit=optional", "--no-audit", "--no-fund"],
    "command": ["npm", "test", "--prefix", "docs/languages/typescript/examples"]
  }
}
