{
  "$schema": "../../../spec/docs/language.schema.json",
  "id": "android",
  "name": "Android",
  "order": 70,
  "status": "preview",
  "codeFence": "kotlin",
  "regionComment": "//",
  "testedFences": ["kotlin", "kt", "kts"],
  "snippetRoots": ["examples/src/main"],
  "packages": [
    {
      "name": "dev.instantrelay:relay-android",
      "slug": "android",
      "layer": "client",
      "summary": "The SDK an Android app depends on: SQLite and SharedPreferences storage, network monitoring, LiveKit calls and message text for notifications. It brings in the other two packages.",
      "runtime": "Android 7.0 (API 24) or later. Apps compile against API 36. Tested with Kotlin 2.2.21.",
      "source": "android/relay"
    },
    {
      "name": "dev.instantrelay:relay-android-core",
      "slug": "android-core",
      "layer": "client",
      "summary": "The platform-free client that `relay-android` brings in: sessions and their renewal, conversations, the store, the offline outbox, timelines, recovery, live sessions and the generated protocol types.",
      "runtime": "Android 7.0 (API 24) or later, through `relay-android`. It isn't a supported entry point on its own.",
      "source": "android/core"
    },
    {
      "name": "dev.instantrelay:relay-android-push",
      "slug": "android-push",
      "layer": "client",
      "summary": "FCM registration, notifications and Telecom incoming calls, with no networking, LiveKit or coroutines, so a React Native or Flutter wrapper can ship it alone.",
      "runtime": "Android 7.0 (API 24) or later. Apps compile against API 34 or later and supply firebase-messaging 25.1.2 or later.",
      "source": "android/push"
    }
  ],
  "quickstarts": ["client", "push", "calling"],
  "operations": "operations.json",
  "extract": {
    "command": ["node", "tools/docgen/extractors/android.mjs", "docs/languages/android/language.json"]
  },
  "test": {
    "command": ["android/gradlew", "-p", "android", "--no-daemon", "--console=plain", ":docs-examples:testDebugUnitTest"]
  }
}
