{
  "$schema": "../../../spec/docs/language.schema.json",
  "id": "go",
  "name": "Go",
  "order": 50,
  "status": "preview",
  "codeFence": "go",
  "regionComment": "//",
  "testedFences": ["go", "golang"],
  "snippetRoots": ["examples"],
  "packages": [
    {
      "name": "github.com/ConvoHop/sdks/go",
      "slug": "relay",
      "layer": "server",
      "summary": "Server SDK for trusted Go backends: backend-key data-plane calls and operator management calls, with typed problems, request retries and recovery storage.",
      "runtime": "Go 1.26 or later",
      "source": "go"
    },
    {
      "name": "github.com/ConvoHop/sdks/go/webhooks",
      "slug": "webhooks",
      "layer": "server",
      "summary": "Verifies Standard Webhooks signatures and parses Relay webhook deliveries into typed events.",
      "runtime": "Go 1.26 or later",
      "source": "go/webhooks"
    },
    {
      "name": "github.com/ConvoHop/sdks/go/push",
      "slug": "push",
      "layer": "server",
      "summary": "Builds APNs, FCM and Web Push requests from Relay push notification events.",
      "runtime": "Go 1.26 or later",
      "source": "go/push"
    }
  ],
  "quickstarts": ["server", "webhooks", "push"],
  "operations": "operations.json",
  "extract": {
    "command": ["go", "run", "-C", "tools/docgen/extractors/go", ".", "../../../../docs/languages/go/language.json"]
  },
  "test": {
    "command": ["go", "test", "-C", "docs/languages/go/examples", "./..."]
  }
}
